{
  "schema_version": "prowl-development-review-v2",
  "development_content_sha256": "5b43a030def4cab54c9992d2941f5ae8fba18156afed2a0ce4fb32cd33eb4979",
  "answers_sha256": "eff9e86a36decaece8841f61e5f6e42f15747c6a12a91a3d47b4ebb33aefe32d",
  "events": [
    {
      "sequence": 1,
      "reviewer": "Quinton Evans",
      "reviewed_at": "2026-10-20T23:05:17Z",
      "stage": "wording_and_answer",
      "decision": "accept",
      "human_statement": "I reviewed and accept these changes and consistency",
      "targets": [
        {
          "id": "q:dev6-31",
          "content_sha256": "8d41dd285fba0697e4edb4862001b68dc60acb1b8c077426dd3c95fd50d6121f"
        },
        {
          "id": "q:dev6-32",
          "content_sha256": "612c464788e90f35be92167413fcfca4e6eee006ff0f59d01a8eee63883dae2f"
        }
      ]
    },
    {
      "sequence": 2,
      "reviewer": "Quinton Evans",
      "reviewed_at": "2026-10-20T23:05:17Z",
      "stage": "evidence_labels",
      "decision": "accept",
      "human_statement": "I reviewed and accept these changes and consistency",
      "targets": [
        {
          "id": "q:dev2-01",
          "content_sha256": "25aa11fbec9fa40a6a10a08859f949d08229b48fb3182d7ede40b8b925283c40"
        },
        {
          "id": "q:dev6-31",
          "content_sha256": "8d41dd285fba0697e4edb4862001b68dc60acb1b8c077426dd3c95fd50d6121f"
        },
        {
          "id": "q:dev2-03",
          "content_sha256": "9da8c6e181d39752ebc06ce3b3d92d13098747e3d02bb5c440b8db80cc79c4fa"
        },
        {
          "id": "q:dev2-04",
          "content_sha256": "3bf6a8bf36318791a9c41c6281c00a5ef771395f2ed72fe7dcc09c7e89cfd6e1"
        },
        {
          "id": "q:dev2-05",
          "content_sha256": "e2a5f3833eb525807a34f1ae0a83b42e8651af025a75f0c9f358953cb84c1858"
        },
        {
          "id": "q:dev2-06",
          "content_sha256": "4efc1408a4a9a297c39aa5cc7bce18f87c795da074f54428f002b3d8306dc4de"
        },
        {
          "id": "q:dev2-07",
          "content_sha256": "c46d14962536cb835f6176437e0c71f27af75c6303f7a7044f285ba9b3e85b4f"
        },
        {
          "id": "q:dev2-08",
          "content_sha256": "f3b308e839315d8b66acc65bb4e1ee3a7be7ed8497c23bf10d4172ab80162310"
        },
        {
          "id": "q:dev2-09",
          "content_sha256": "bed7c9d32c5cf607ef99707ac0ac8ecb0835dd6fb6d4e8bd4b1a14bee0637c05"
        },
        {
          "id": "q:dev2-10",
          "content_sha256": "35a6310bea43856cd1499f04f6d0ec11a0664e7d4cb531d74ededef2118501ce"
        },
        {
          "id": "q:dev2-11",
          "content_sha256": "6c609190c583c8aabf75df0caf4a710fbdc95ef81a3517d767032502c879e818"
        },
        {
          "id": "q:dev2-12",
          "content_sha256": "965e45367b0e7d787e4ea9a902e8abc756558fc12cb7e6200e50b15c1d7c9675"
        },
        {
          "id": "q:dev2-13",
          "content_sha256": "dd2da82901e4625c570be791ae1fb588de30892c37843fff4101ba1e2ce13713"
        },
        {
          "id": "q:dev2-14",
          "content_sha256": "33d51bb9e920e265a6509c386c414327ecced3c1e87c925130461b8e35073be0"
        },
        {
          "id": "q:dev6-32",
          "content_sha256": "612c464788e90f35be92167413fcfca4e6eee006ff0f59d01a8eee63883dae2f"
        },
        {
          "id": "q:dev2-16",
          "content_sha256": "cc82b597e93e7e28f64795d51748d4cb36f13d8d882f736ff1dbdaa90e0b750d"
        },
        {
          "id": "q:dev2-17",
          "content_sha256": "d36063140140ba5fd8f93c6280f395439c5ae8e5ae0b51f37d6d52c87536c405"
        },
        {
          "id": "q:dev2-18",
          "content_sha256": "38ca764254054e5f7e24b67a19719564d2e427fcb69a36fb7cc48344219d2e52"
        },
        {
          "id": "q:dev2-19",
          "content_sha256": "a06a4e113f48c6bc97da85d9bc8e9801b065f2410b1c46e667c0f74150c86aaf"
        },
        {
          "id": "q:dev2-20",
          "content_sha256": "b46f563f0d8e77db23d0953eef49f256fc378c11f2edbda536195f5f9e3942f9"
        },
        {
          "id": "q:dev2-29",
          "content_sha256": "c0ed56a5b94d3c9ddbd2b5a57dfcbf75c78e0d142d49d22843a97245f4a6880b"
        },
        {
          "id": "q:dev2-30",
          "content_sha256": "55b1691d22aebb3651b1f8e804b15d9156b9e461e2777b125877490c4f3d61e4"
        }
      ]
    },
    {
      "sequence": 3,
      "reviewer": "Quinton Evans",
      "reviewed_at": "2026-10-20T23:05:17Z",
      "stage": "second_consistency",
      "decision": "accept",
      "human_statement": "I reviewed and accept these changes and consistency",
      "targets": [
        {
          "id": "q:dev2-01",
          "content_sha256": "25aa11fbec9fa40a6a10a08859f949d08229b48fb3182d7ede40b8b925283c40"
        },
        {
          "id": "q:dev6-31",
          "content_sha256": "8d41dd285fba0697e4edb4862001b68dc60acb1b8c077426dd3c95fd50d6121f"
        },
        {
          "id": "q:dev2-03",
          "content_sha256": "9da8c6e181d39752ebc06ce3b3d92d13098747e3d02bb5c440b8db80cc79c4fa"
        },
        {
          "id": "q:dev2-04",
          "content_sha256": "3bf6a8bf36318791a9c41c6281c00a5ef771395f2ed72fe7dcc09c7e89cfd6e1"
        },
        {
          "id": "q:dev2-05",
          "content_sha256": "e2a5f3833eb525807a34f1ae0a83b42e8651af025a75f0c9f358953cb84c1858"
        },
        {
          "id": "q:dev2-06",
          "content_sha256": "4efc1408a4a9a297c39aa5cc7bce18f87c795da074f54428f002b3d8306dc4de"
        },
        {
          "id": "q:dev2-07",
          "content_sha256": "c46d14962536cb835f6176437e0c71f27af75c6303f7a7044f285ba9b3e85b4f"
        },
        {
          "id": "q:dev2-08",
          "content_sha256": "f3b308e839315d8b66acc65bb4e1ee3a7be7ed8497c23bf10d4172ab80162310"
        },
        {
          "id": "q:dev2-09",
          "content_sha256": "bed7c9d32c5cf607ef99707ac0ac8ecb0835dd6fb6d4e8bd4b1a14bee0637c05"
        },
        {
          "id": "q:dev2-10",
          "content_sha256": "35a6310bea43856cd1499f04f6d0ec11a0664e7d4cb531d74ededef2118501ce"
        },
        {
          "id": "q:dev2-11",
          "content_sha256": "6c609190c583c8aabf75df0caf4a710fbdc95ef81a3517d767032502c879e818"
        },
        {
          "id": "q:dev2-12",
          "content_sha256": "965e45367b0e7d787e4ea9a902e8abc756558fc12cb7e6200e50b15c1d7c9675"
        },
        {
          "id": "q:dev2-13",
          "content_sha256": "dd2da82901e4625c570be791ae1fb588de30892c37843fff4101ba1e2ce13713"
        },
        {
          "id": "q:dev2-14",
          "content_sha256": "33d51bb9e920e265a6509c386c414327ecced3c1e87c925130461b8e35073be0"
        },
        {
          "id": "q:dev6-32",
          "content_sha256": "612c464788e90f35be92167413fcfca4e6eee006ff0f59d01a8eee63883dae2f"
        },
        {
          "id": "q:dev2-16",
          "content_sha256": "cc82b597e93e7e28f64795d51748d4cb36f13d8d882f736ff1dbdaa90e0b750d"
        },
        {
          "id": "q:dev2-17",
          "content_sha256": "d36063140140ba5fd8f93c6280f395439c5ae8e5ae0b51f37d6d52c87536c405"
        },
        {
          "id": "q:dev2-18",
          "content_sha256": "38ca764254054e5f7e24b67a19719564d2e427fcb69a36fb7cc48344219d2e52"
        },
        {
          "id": "q:dev2-19",
          "content_sha256": "a06a4e113f48c6bc97da85d9bc8e9801b065f2410b1c46e667c0f74150c86aaf"
        },
        {
          "id": "q:dev2-20",
          "content_sha256": "b46f563f0d8e77db23d0953eef49f256fc378c11f2edbda536195f5f9e3942f9"
        },
        {
          "id": "q:dev2-21",
          "content_sha256": "a22f12c1f8867fce91b1f35be56ce7ed41b5dd1a09aba8a0e5fb15c7174a2cf5"
        },
        {
          "id": "q:dev2-22",
          "content_sha256": "c83c4ec45865d32f3235f68b6d00a3cfaee3370400f3b473fe3ffb2045b04960"
        },
        {
          "id": "q:dev2-23",
          "content_sha256": "004d5fb25707da09be78429b480c5ce048c1c7825e368d13c561343b70e6d476"
        },
        {
          "id": "q:dev2-24",
          "content_sha256": "005293945d576630d2503aff821c2af35c88e0e5b2e98f9bd03b6d8933b23521"
        },
        {
          "id": "q:dev2-25",
          "content_sha256": "104e095947003c4240d48d74bb82394fecf0096aca6dcb9c9ddcabdc6b40e073"
        },
        {
          "id": "q:dev2-26",
          "content_sha256": "136b220fac4afaba8c4e7498e7a98b51fbe0cd1f1cf6cbf8f3fd181a64927b08"
        },
        {
          "id": "q:dev2-27",
          "content_sha256": "65659ae8851ffa54b2824ab566e75947c79470d1916cd78067f4ada43fec9457"
        },
        {
          "id": "q:dev2-28",
          "content_sha256": "5c19e3890049b1f0148e9ba3973b82f8e14a3dc73b209b27ddf23ea6433de163"
        },
        {
          "id": "q:dev2-29",
          "content_sha256": "c0ed56a5b94d3c9ddbd2b5a57dfcbf75c78e0d142d49d22843a97245f4a6880b"
        },
        {
          "id": "q:dev2-30",
          "content_sha256": "55b1691d22aebb3651b1f8e804b15d9156b9e461e2777b125877490c4f3d61e4"
        }
      ]
    }
  ],
  "content_sha256": "6a90ba38ee1b84e65b3200c0db632d96ac239614383b82f584f2737a40b7dcde"
}
