{
  "schema_version": "prowl-development-review-v2",
  "development_content_sha256": "5b43a030def4cab54c9992d2941f5ae8fba18156afed2a0ce4fb32cd33eb4979",
  "answers_sha256": "0a2ecb904fb35ba79b9d014fca66dfecf61387152e666f59741d924a853ba88f",
  "events": [],
  "content_sha256": "998076b0d796bb52a64f732a3ae4e9453c144ca3394285ca85d863735add71f7"
}
